target_id,priority,status,readiness_level,biological_process,current_proxy,next_action,source_count,required_data
trail_decay_curve,P0,missing_digitized_data,2.5,Pheromone trail decay after food removal or rain/washout.,literature_pheromone_constraints_v1 checks qualitative persistence effects only.,Digitize trail decay or trail occupancy time series and map model day to the paper's time axis.,2,time since food removal or washout; trail pheromone proxy or trail occupancy; species/arena conditions; replicate variance or confidence interval
food_recruitment_strength_curve,P0,missing_digitized_data,2.5,Food quality or concentration versus recruitment/trail-laying strength.,paper_conditions_v5 checks high-quality source bias qualitatively.,Digitize food-quality recruitment curves and add a concentration-to-quality mapping.,1,food concentration or quality; trail-laying event rate or recruitment count; time window; species and colony state
double_bridge_branch_choice_curve,P0,model_reference_only,3.0,Branch choice probability/time course under symmetric and biased trails.,"calibrate_double_bridge.py fits a literature model reference, not raw biological counts.",Replace or supplement the model reference with digitized branch-choice curves from a real double-bridge experiment.,1,time or crossing index; branch choice probability; path length / bridge geometry; replicate count
traffic_flow_density_curve,P1,qualitative_proxy_only,2.8,Trail density versus speed/flow under crowding.,paper_conditions_v5 exports segment speed/flow-density metrics.,Digitize speed-density or flow-density curves and fit contact/crowding parameters.,2,linear density; mean speed; flow or flux; trail geometry
brood_survival_microclimate_curve,P0,missing_digitized_data,2.5,Temperature/humidity stress versus brood survival or development.,paper_conditions_v5 checks brood-stage-sensitive microclimate qualitatively.,Digitize brood survival/development curves or collect lab data for the target species.,1,temperature and humidity; brood stage composition; survival or development rate; time horizon
founding_worker_emergence_curve,P1,missing_digitized_data,2.5,"Queen founding reserves, egg laying and first worker emergence over time.",actual_biology_simulation.py has founding_colony viability smoke output only.,Select a target species and add founding-stage laboratory or literature count curves.,0,days since founding; egg/larva/pupa/worker counts; queen survival and reserve state; temperature and feeding regime
